{
  "schema_version": "psb-github-releases-collector-policy/v1",
  "source": "test-fixture",
  "profile_id": "slsa-build-l2",
  "issuer_role": "security-monitor",
  "scope": {
    "producer_id": "https://producer.example.invalid/product",
    "build_platform_id": "https://build.example.invalid/release",
    "consumer_id": "https://consumer.example.invalid/verifier",
    "artifact_family": "example/product",
    "release_id": "product-v1.2.3",
    "source_revision": "0123456789abcdef0123456789abcdef01234567"
  },
  "repository": "example/product",
  "release_tag": "product-v1.2.3",
  "artifact": {
    "name": "product-linux-amd64",
    "sha256": "9c8f10fd1da5d3db9b1afa8bb65fb320ce2ca3f5978551f489d4ac4ff52e3437",
    "content_type": "application/octet-stream"
  },
  "provenance": {
    "name": "product-linux-amd64.intoto.jsonl",
    "sha256": "880a07c84518ea8b685f99cbdee173b0c1f33bf28a635777b8baa092ca2986e1",
    "content_type": "application/vnd.in-toto+json"
  },
  "maximum_publication_delay_seconds": 300,
  "receipt_uri": "https://evidence.example.invalid/slsa/github-releases/storage-probe.json",
  "release_fixture": "release.json"
}
